{
  "$schema": "https://json-schema.org/draft/2020-12/schema",
  "$id": "https://facta-leopard.github.io/ForgePlay/site-data/compatibility.schema.json",
  "title": "ForgePlay compatibility database",
  "type": "object",
  "additionalProperties": false,
  "required": [
    "schemaVersion",
    "updatedAt",
    "testProfiles",
    "games",
    "reports"
  ],
  "properties": {
    "$schema": {
      "type": "string"
    },
    "schemaVersion": {
      "const": 3
    },
    "updatedAt": {
      "type": "string",
      "format": "date"
    },
    "revision": {
      "type": "integer",
      "minimum": 0,
      "maximum": 9007199254740991,
      "description": "Optional schema-3 publication sequence for this date; omission is equivalent to zero. Increment for a changed payload on the same date."
    },
    "testProfiles": {
      "type": "array",
      "items": {
        "$ref": "#/$defs/testProfile"
      }
    },
    "games": {
      "type": "array",
      "items": {
        "$ref": "#/$defs/game"
      }
    },
    "reports": {
      "type": "array",
      "items": {
        "$ref": "#/$defs/report"
      }
    }
  },
  "$defs": {
    "identifier": {
      "type": "string",
      "pattern": "^[a-z0-9]+(?:-[a-z0-9]+)*$"
    },
    "localizedText": {
      "type": "object",
      "minProperties": 1,
      "additionalProperties": {
        "type": "string",
        "minLength": 1
      }
    },
    "gameTitles": {
      "type": "object",
      "required": [
        "en",
        "ko"
      ],
      "properties": {
        "en": {
          "type": "string",
          "minLength": 1
        },
        "ko": {
          "type": "string",
          "minLength": 1,
          "pattern": "[가-힣]"
        }
      },
      "additionalProperties": {
        "type": "string",
        "minLength": 1
      }
    },
    "testProfile": {
      "type": "object",
      "additionalProperties": false,
      "required": [
        "id",
        "platform",
        "chip",
        "unifiedMemoryGB",
        "macOSVersion"
      ],
      "properties": {
        "id": {
          "$ref": "#/$defs/identifier"
        },
        "platform": {
          "type": "string",
          "minLength": 1
        },
        "chip": {
          "type": "string",
          "minLength": 1
        },
        "unifiedMemoryGB": {
          "type": [
            "integer",
            "null"
          ],
          "minimum": 1
        },
        "macOSVersion": {
          "type": [
            "string",
            "null"
          ]
        }
      }
    },
    "game": {
      "type": "object",
      "additionalProperties": false,
      "required": [
        "id",
        "titles"
      ],
      "properties": {
        "id": {
          "$ref": "#/$defs/identifier"
        },
        "titles": {
          "$ref": "#/$defs/gameTitles"
        }
      }
    },
    "report": {
      "type": "object",
      "additionalProperties": false,
      "required": [
        "id",
        "gameId",
        "launchPlatform",
        "testProfileId",
        "status",
        "source",
        "testedAt",
        "notes",
        "blocker"
      ],
      "properties": {
        "id": {
          "$ref": "#/$defs/identifier"
        },
        "gameId": {
          "$ref": "#/$defs/identifier"
        },
        "launchPlatform": {
          "enum": ["steam", "battlenet", "epic", "stove", "exe", "vr", "unknown"],
          "description": "Reported execution platform, not the renderer, hardware platform or purchase source."
        },
        "testProfileId": {
          "anyOf": [
            {
              "$ref": "#/$defs/identifier"
            },
            {
              "type": "null"
            }
          ]
        },
        "forgePlayVersion": {
          "type": [
            "string",
            "null"
          ],
          "minLength": 1,
          "description": "Published ForgePlay version, or the reserved value 'development' for an unreleased development build."
        },
        "gameVersion": {
          "type": [
            "string",
            "null"
          ],
          "minLength": 1
        },
        "status": {
          "enum": [
            "playable",
            "testing",
            "blocked",
            "unknown"
          ]
        },
        "source": {
          "enum": [
            "project-test",
            "github-issue",
            "community-report"
          ]
        },
        "reporter": {
          "type": "string",
          "minLength": 1
        },
        "testedAt": {
          "type": [
            "string",
            "null"
          ],
          "format": "date"
        },
        "notes": {
          "anyOf": [
            {
              "$ref": "#/$defs/localizedText"
            },
            {
              "type": "null"
            }
          ]
        },
        "blocker": {
          "type": [
            "string",
            "null"
          ],
          "enum": [
            "anti-cheat",
            "launcher",
            "graphics",
            "runtime",
            "security-module",
            "unknown",
            null
          ]
        }
      }
    }
  }
}
