{
  "$schema": "./compatibility.schema.json",
  "schemaVersion": 3,
  "updatedAt": "2026-10-14",
  "revision": 0,
  "testProfiles": [
    {
      "id": "apple-silicon-m5-pro-64gb-macos-27-0-1",
      "platform": "Apple Silicon Mac",
      "chip": "M5 Pro",
      "unifiedMemoryGB": 64,
      "macOSVersion": "27.0.1"
    },
    {
      "id": "apple-silicon-m5-pro-24gb-macos-27-0-1",
      "platform": "Apple Silicon Mac",
      "chip": "M5 Pro",
      "unifiedMemoryGB": 24,
      "macOSVersion": "27.0.1"
    },
    {
      "id": "macbook-air-m5-16gb-macos-27-0-1",
      "platform": "MacBook Air",
      "chip": "M5",
      "unifiedMemoryGB": 16,
      "macOSVersion": "27.0.1"
    },
    {
      "id": "apple-silicon-m2-max-32gb-golden-gate-27-2",
      "platform": "Apple Silicon Mac",
      "chip": "M2 Max",
      "unifiedMemoryGB": 32,
      "macOSVersion": "Golden Gate 27.2"
    },
    {
      "id": "apple-silicon-m5-max-full-128gb",
      "platform": "Apple Silicon Mac",
      "chip": "M5 Max (full)",
      "unifiedMemoryGB": 128,
      "macOSVersion": null
    },
    {
      "id": "apple-silicon-m4-pro-binned-24gb-macos-27-0-1",
      "platform": "Apple Silicon Mac",
      "chip": "M4 Pro (binned)",
      "unifiedMemoryGB": 24,
      "macOSVersion": "27.0.1"
    },
    {
      "id": "macbook-pro-16-m5-pro-48gb-macos-27-0-1",
      "platform": "MacBook Pro (16-inch)",
      "chip": "M5 Pro",
      "unifiedMemoryGB": 48,
      "macOSVersion": "27.0.1"
    },
    {
      "id": "macbook-air-13-m5-macos-27",
      "platform": "MacBook Air (13-inch)",
      "chip": "M5",
      "unifiedMemoryGB": null,
      "macOSVersion": "27"
    },
    {
      "id": "apple-silicon-m5-max-128gb-macos-27-0-1",
      "platform": "Apple Silicon Mac",
      "chip": "M5 Max",
      "unifiedMemoryGB": 128,
      "macOSVersion": "27.0.1"
    },
    {
      "id": "apple-silicon-m5-pro-24gb-macos-27-0",
      "platform": "Apple Silicon Mac",
      "chip": "M5 Pro",
      "unifiedMemoryGB": 24,
      "macOSVersion": "27.0"
    },
    {
      "id": "apple-silicon-m4-pro-24gb-macos-27-0",
      "platform": "Apple Silicon Mac",
      "chip": "M4 Pro",
      "unifiedMemoryGB": 24,
      "macOSVersion": "27.0"
    },
    {
      "id": "imac-m4-10-core-24gb-macos-27",
      "platform": "iMac",
      "chip": "M4 (10-core)",
      "unifiedMemoryGB": 24,
      "macOSVersion": "27"
    },
    {
      "id": "macbook-air-m3-8gb-tahoe-26-5-1",
      "platform": "MacBook Air",
      "chip": "M3",
      "unifiedMemoryGB": 8,
      "macOSVersion": "Tahoe 26.5.1 (25F80)"
    },
    {
      "id": "apple-silicon-m5-pro-24gb-macos-26-6-2",
      "platform": "Apple Silicon Mac",
      "chip": "M5 Pro",
      "unifiedMemoryGB": 24,
      "macOSVersion": "macOS 26.6.2 (25G83)"
    },
    {
      "id": "apple-silicon-m4-pro-24gb",
      "platform": "Apple Silicon Mac",
      "chip": "M4 Pro",
      "unifiedMemoryGB": 24,
      "macOSVersion": null
    },
    {
      "id": "apple-silicon-m3-max-36gb-tahoe-26-5-1",
      "platform": "Apple Silicon Mac",
      "chip": "M3 Max",
      "unifiedMemoryGB": 36,
      "macOSVersion": "Tahoe 26.5.1"
    },
    {
      "id": "apple-silicon-m5-max",
      "platform": "Apple Silicon Mac",
      "chip": "M5 Max",
      "unifiedMemoryGB": null,
      "macOSVersion": null
    },
    {
      "id": "apple-silicon-m5-max-64gb-tahoe-26-5-2",
      "platform": "Apple Silicon Mac",
      "chip": "M5 Max",
      "unifiedMemoryGB": 64,
      "macOSVersion": "Tahoe 26.5.2"
    },
    {
      "id": "apple-silicon-m4-air-16gb",
      "platform": "MacBook Air",
      "chip": "M4",
      "unifiedMemoryGB": 16,
      "macOSVersion": null
    },
    {
      "id": "apple-silicon-m5-pro-24gb-tahoe-26-5-2",
      "platform": "Apple Silicon Mac",
      "chip": "M5 Pro",
      "unifiedMemoryGB": 24,
      "macOSVersion": "Tahoe 26.5.2"
    },
    {
      "id": "apple-silicon-m5-max-128gb-tahoe-26-5-2",
      "platform": "Apple Silicon Mac",
      "chip": "M5 Max",
      "unifiedMemoryGB": 128,
      "macOSVersion": "Tahoe 26.5.2"
    },
    {
      "id": "apple-silicon-m4-pro-24gb-macos-27-beta-3",
      "platform": "Apple Silicon Mac",
      "chip": "M4 Pro",
      "unifiedMemoryGB": 24,
      "macOSVersion": "27 beta 3"
    },
    {
      "id": "apple-silicon-m5-max-64gb-macos-26-4",
      "platform": "Apple Silicon Mac",
      "chip": "M5 Max",
      "unifiedMemoryGB": 64,
      "macOSVersion": "26.4"
    },
    {
      "id": "macbook-air-m5-16gb",
      "platform": "MacBook Air",
      "chip": "M5",
      "unifiedMemoryGB": 16,
      "macOSVersion": null
    },
    {
      "id": "apple-silicon-m4-pro-24gb-macos-26-6-1",
      "platform": "Apple Silicon Mac",
      "chip": "M4 Pro",
      "unifiedMemoryGB": 24,
      "macOSVersion": "Tahoe 26.6.1"
    },
    {
      "id": "macbook-pro-m5-16gb-tahoe-26-6",
      "platform": "MacBook Pro",
      "chip": "M5",
      "unifiedMemoryGB": 16,
      "macOSVersion": "Tahoe 26.6"
    },
    {
      "id": "apple-silicon-m3-max",
      "platform": "Apple Silicon Mac",
      "chip": "M3 Max",
      "unifiedMemoryGB": null,
      "macOSVersion": null
    },
    {
      "id": "apple-silicon-m5-pro-24gb",
      "platform": "Apple Silicon Mac",
      "chip": "M5 Pro",
      "unifiedMemoryGB": 24,
      "macOSVersion": null
    },
    {
      "id": "apple-silicon-m5-pro-48gb-tahoe-26-6-2",
      "platform": "Apple Silicon Mac",
      "chip": "M5 Pro",
      "unifiedMemoryGB": 48,
      "macOSVersion": "Tahoe 26.6.2"
    },
    {
      "id": "apple-silicon-m2-pro-16gb-tahoe-26-6-2",
      "platform": "Apple Silicon Mac",
      "chip": "M2 Pro",
      "unifiedMemoryGB": 16,
      "macOSVersion": "Tahoe 26.6.2"
    },
    {
      "id": "macbook-pro-m4-pro-12-core-24gb-macos-26-6-2-25g83",
      "platform": "MacBook Pro",
      "chip": "M4 Pro",
      "unifiedMemoryGB": 24,
      "macOSVersion": "26.6.2 (25G83)"
    },
    {
      "id": "apple-silicon-m4-24gb-tahoe-26-5",
      "platform": "Apple Silicon Mac",
      "chip": "M4",
      "unifiedMemoryGB": 24,
      "macOSVersion": "Tahoe 26.5"
    },
    {
      "id": "community-m6-16gb-golden-gate-27-0",
      "platform": "Apple Silicon Mac",
      "chip": "M6",
      "unifiedMemoryGB": 16,
      "macOSVersion": "Golden Gate 27.0"
    },
    {
      "id": "apple-silicon-m5-max-32gb-golden-gate-27-0-1",
      "platform": "Apple Silicon Mac",
      "chip": "M5 Max",
      "unifiedMemoryGB": 32,
      "macOSVersion": "Golden Gate 27.0.1"
    }
  ],
  "games": [
    {
      "id": "where-winds-meet",
      "titles": {
        "en": "Where Winds Meet",
        "ko": "연운"
      }
    },
    {
      "id": "apollo-justice-ace-attorney-trilogy",
      "titles": {
        "en": "Apollo Justice: Ace Attorney Trilogy",
        "ko": "역전재판 456 오도로키 셀렉션"
      }
    },
    {
      "id": "dasi-gireul-geotda",
      "titles": {
        "en": "다시, 길을 걷다",
        "ko": "다시, 길을 걷다"
      }
    },
    {
      "id": "phoenix-wright-ace-attorney-trilogy",
      "titles": {
        "en": "Phoenix Wright: Ace Attorney Trilogy",
        "ko": "역전재판 123 나루호도 셀렉션"
      }
    },
    {
      "id": "last-epoch",
      "titles": {
        "en": "Last Epoch",
        "ko": "라스트 에폭"
      }
    },
    {
      "id": "dave-the-diver",
      "titles": {
        "en": "DAVE THE DIVER",
        "ko": "데이브 더 다이버"
      }
    },
    {
      "id": "stardew-valley",
      "titles": {
        "en": "Stardew Valley",
        "ko": "스타듀밸리"
      }
    },
    {
      "id": "the-callisto-protocol",
      "titles": {
        "en": "The Callisto Protocol",
        "ko": "칼리스토 프로토콜"
      }
    },
    {
      "id": "assassins-creed-brotherhood",
      "titles": {
        "en": "Assassin's Creed: Brotherhood",
        "ko": "어쌔신 크리드: 브라더후드"
      }
    },
    {
      "id": "warcraft-3",
      "titles": {
        "en": "Warcraft III",
        "ko": "워크래프트 3"
      }
    },
    {
      "id": "witch-trainer",
      "titles": {
        "en": "Witch Trainer",
        "ko": "위치 트레이너"
      }
    },
    {
      "id": "jazz-jackrabbit-2",
      "titles": {
        "en": "Jazz Jackrabbit 2",
        "ko": "재즈 잭래빗 2"
      }
    },
    {
      "id": "romance-of-the-three-kingdoms-6",
      "titles": {
        "en": "Romance of the Three Kingdoms VI",
        "ko": "삼국지 6"
      }
    },
    {
      "id": "romance-of-the-three-kingdoms-9-pk",
      "titles": {
        "en": "Romance of the Three Kingdoms IX with Power Up Kit",
        "ko": "삼국지 9PK"
      }
    },
    {
      "id": "romance-of-the-three-kingdoms-12",
      "titles": {
        "en": "Romance of the Three Kingdoms XII",
        "ko": "삼국지 12"
      }
    },
    {
      "id": "the-evil-within",
      "titles": {
        "en": "The Evil Within",
        "ko": "이블 위딘 1"
      }
    },
    {
      "id": "dagon",
      "titles": {
        "en": "Dagon",
        "ko": "다곤(Dagon)"
      }
    },
    {
      "id": "the-lab",
      "titles": {
        "en": "The Lab",
        "ko": "더 랩(The Lab)"
      }
    },
    {
      "id": "marvels-spider-man-miles-morales",
      "titles": {
        "en": "Marvel's Spider-Man: Miles Morales",
        "ko": "마블 스파이더맨: 마일즈 모랄레스"
      }
    },
    {
      "id": "marvels-spider-man-remastered",
      "titles": {
        "en": "Marvel's Spider-Man Remastered",
        "ko": "마블 스파이더맨 리마스터"
      }
    },
    {
      "id": "52-hertz",
      "titles": {
        "en": "52 Hertz",
        "ko": "52헤르츠"
      }
    },
    {
      "id": "the-binding-of-isaac",
      "titles": {
        "en": "The Binding of Isaac",
        "ko": "아이작"
      }
    },
    {
      "id": "path-of-exile",
      "titles": {
        "en": "Path of Exile",
        "ko": "패스 오브 엑자일 1"
      }
    },
    {
      "id": "path-of-exile-2",
      "titles": {
        "en": "Path of Exile 2",
        "ko": "패스 오브 엑자일 2"
      }
    },
    {
      "id": "delta-force",
      "titles": {
        "en": "Delta Force",
        "ko": "델타포스"
      }
    },
    {